{
  "title": "客户列表",
  "layout": "list-detail",
  "list": {
    "type": "table",
    "data": "{{ db.customers }}",
    "columns": [
      { "field": "name", "label": "姓名", "sortable": true, "search": true },
      { "field": "phone", "label": "电话" },
      { "field": "status", "label": "状态", "render": "tag" },
      { "field": "created_at", "label": "创建时间", "render": "date" }
    ],
    "filter": [
      { "field": "status", "options": ["active", "inactive"] }
    ],
    "actions": {
      "row": [
        { "label": "删除", "run": "db:delete:customers", "confirm": true }
      ],
      "toolbar": [
        { "label": "新增", "open": "dialog:create", "primary": true }
      ]
    }
  },
  "detail": {
    "view": {
      "form": [
        { "type": "text", "name": "name", "label": "姓名", "required": true },
        { "type": "text", "name": "phone", "label": "电话" },
        { "type": "select", "name": "status", "label": "状态", "options": ["active", "inactive"] }
      ],
      "submit": { "label": "保存", "run": "db:update:customers" }
    }
  }
}
